title,description,release,cover,author_ids,category_ids,price,oneStarCount,twoStarCount,threeStarCount,fourStarCount,fiveStarCount
The Romance of Lust: A classic Victorian erotic novel,"""The Romance of Lust"" by Anonymous is a classic Victorian erotic novel written in the late 19th century. This provocative narrative dives into themes of sexual awakening, exploration, and taboo relationships through the private experiences of its young protagonist, Charles, as he navigates his desires alongside his sisters, peers, and a scandalous governess, Miss Evelyn.   The opening of the novel establishes a setting steeped in both innocence and burgeoning sexuality. It introduces Charles and his sisters, highlighting their obliviousness to the implications of their curious behavior as they begin to explore their bodies together and with their governess. The initial chapters hint at the complex interplay between forbidden desires and formal constraints, as Miss Evelyn becomes a focal point of Charles' awakening sexual curiosity. Explicit descriptions of Charles' encounters with both Miss Evelyn and his sisters set the tone for the book, which promises to venture deep into the themes of youthful sexual exploration entwined with guilt, pleasure, and societal norms of the time. (This is an automatically generated summary.)",1949-06-08,https://www.gutenberg.org/cache/epub/30254/pg30254.cover.medium.jpg,1,78|5|80|81|5|83|84|5|86|5,19,464,55,449,242,205
Little Women,"""Little Women"" by Louisa May Alcott is a novel written during the mid-19th century. The story revolves around the lives of the four March sisters—Meg, Jo, Beth, and Amy—as they navigate the challenges of growing up in a time of hardship brought on by the Civil War, while balancing their dreams, ambitions, and family values. The narrative explores themes of poverty, sacrifice, and the strength of sisterly love, making it both a heartwarming and poignant read.  The opening of the book introduces the March family in a time of struggle, particularly during the Christmas season when the girls lament their lack of presents due to their family's financial difficulties. They discuss their dreams and desires, which reveals their distinct personalities: Jo is spirited and tomboyish, Meg yearns for luxury, Beth is gentle and selfless, and Amy is creative and somewhat vain. The sisters are determined to bring joy to their mother, whom they affectionately call ‘Marmee,’ planning secret gifts for her that embody their love and thoughtfulness. This initial chapter sets up the foundation for a story rich with character development and the trials and joys of family life, drawing readers into the world of the March sisters and their heartfelt journey toward adulthood. (This is an automatically generated summary.)",1949-06-08,https://www.gutenberg.org/cache/epub/514/pg514.cover.medium.jpg,1,88|1|89|90|91|5|93|5|95|5|91|5|99|5|101|5,21,89,264,92,220,468
Plays,"""Plays by Susan Glaspell"" is a collection of dramatic works written during the early 20th century, featuring notable titles such as ""Trifles,"" ""The Outside,"" and ""The Verge."" The plays often explore themes of gender roles, societal expectations, and human psychology, showcasing the nuanced struggles of women in a male-dominated world. Through rich character development, Glaspell highlights the emotional landscapes of her protagonists, inviting contemplation about the nature of truth and justice.   At the start of ""Trifles,"" the scene is set in a disordered farmhouse kitchen, where a group of men, including the county attorney and sheriff, arrive to investigate the murder of John Wright, a domineering husband. Meanwhile, the wives of the men, Mrs. Hale and Mrs. Peters, enter slowly and begin to observe the seemingly trivial details of the kitchen. While the men dismiss these as unimportant, the women uncover clues about the deceased and the potential motive for murder, particularly through their empathy for Mrs. Wright's situation. This initial exploration of domestic space lays the groundwork for a powerful commentary on the often-overlooked significance of women's experiences and insights. (This is an automatically generated summary.)",1949-06-08,https://www.gutenberg.org/cache/epub/10623/pg10623.cover.medium.jpg,1,1,25,90,226,314,208,344
A Study in Scarlet,"""A Study in Scarlet"" by Arthur Conan Doyle is a detective novel written during the late 19th century. The story introduces readers to the legendary detective Sherlock Holmes and his newly acquainted friend, Dr. John Watson, who becomes his roommate and chronicler. The narrative sets the stage for a captivating mystery that intertwines crime, deduction, and a glimpse into the complexities of human nature.  At the start of the novel, Dr. Watson recounts his background, detailing his experiences as an army doctor in Afghanistan, his return to England, and his subsequent meeting with Sherlock Holmes, a peculiar but brilliant investigator. Their initial interactions reveal Holmes's unusual methods and keen deductive skills, foreshadowing the unraveling mystery they will face together. The latter part of the opening section includes a chilling murder case involving a man named Enoch Drebber, whose lifeless body is discovered under mysterious circumstances, suggesting a larger intrigue fueled by revenge. As Watson and Holmes embark on this case, the reader is drawn into a thrilling narrative filled with observation, analysis, and the complexities of crime. (This is an automatically generated summary.)",1949-06-08,https://www.gutenberg.org/cache/epub/244/pg244.cover.medium.jpg,1,104|105|5|107|5|109|105|5,23,160,199,266,175,276
Moby Word Lists,,1949-06-08,https://www.gutenberg.org/cache/epub/3201/pg3201.cover.medium.jpg,1,112|113,29,20,495,45,96,323
The Tragical History of Doctor Faustus: From the Quarto of 1604,"""The Tragical History of Doctor Faustus"" by Christopher Marlowe is a play that was likely written during the late 16th century. This dramatic work explores themes of ambition, desire, and the consequences of pursuing forbidden knowledge through the tragic story of its main character, Dr. Faustus, a scholar who seeks to gain unlimited knowledge and power by making a pact with the devil.  The opening of the play introduces us to Dr. Faustus, who is disillusioned with traditional forms of academia. Despite his considerable knowledge in various fields, Faustus craves more and turns to necromancy in his quest for ultimate power. In his study, he debates the merits of different disciplines before ultimately deciding to delve into magic. He is soon joined by companions who encourage his pursuits, and we witness his internal conflict between good and evil as he is tempted by both a Good Angel and an Evil Angel. As Faustus embarks on his fateful journey, he prepares to conjure Mephistophilis, a demon who will fulfill his desires but at a dire cost. This complex interplay of ambition and moral choice sets the stage for Faustus's tragic fall. (This is an automatically generated summary.)",1949-06-08,https://www.gutenberg.org/cache/epub/779/pg779.cover.medium.jpg,1,114|115|116|115|118|115|120,22,0,203,229,410,494
The Legend of Sleepy Hollow,"""The Legend of Sleepy Hollow"" by Washington Irving is a classic short story from the early 19th century, specifically during the Romantic era. This tale is a blend of folklore and ghost story that takes place in the mythical village of Sleepy Hollow, where supernatural occurrences and local legends intertwine within a vividly described rural setting. The narrative centers on themes of love, rivalry, and the collision of rational thought with superstition.  The story primarily follows Ichabod Crane, a lanky schoolteacher who arrives in Sleepy Hollow to woo the beautiful Katrina Van Tassel, daughter of a wealthy farmer. However, he is met with competition from the burly Brom Bones, who is equally determined to win her affections. As Ichabod navigates his way through local superstitions and his own fear of the supernatural, he ultimately encounters the infamous Headless Horseman during a fateful ride home. The story culminates in a climactic chase that leads to Ichabod's mysterious disappearance. Through entertaining characters and a blend of humor and horror, Irving crafts a story that remains a beloved part of American literature, exploring themes of ambition, jealousy, and the power of legend. (This is an automatically generated summary.)",1949-06-08,https://www.gutenberg.org/cache/epub/41/pg41.cover.medium.jpg,1,121|5|123|3|125|5,25,187,367,218,357,439
Novo dicionário da língua portuguesa,"""Novo Dicionário da Língua Portuguesa"" by Cândido de Figueiredo is a comprehensive dictionary written in the early 20th century. This lexicographic work seeks to compile and standardize Portuguese vocabulary, reflecting contemporary linguistic practices while also incorporating historical and regional terms. The book aims to enrich the language by acknowledging popular and scientific terminology, promoting a unified understanding of Portuguese across different regions and cultures.  The opening of the dictionary outlines the author's motivation for creating a new lexicon and reflects on past dictionaries’ shortcomings. Cândido de Figueiredo criticizes previous works for their lack of completeness and alignment with modern usage, noting that many common and valuable terms, especially from popular and scientific contexts, were missing. He emphasizes the importance of including a diverse array of terms to reflect the richness of the Portuguese language and its evolution, particularly highlighting the lexicon's role in bridging regional dialects and contemporary vocabulary. (This is an automatically generated summary.)",1949-06-08,https://www.gutenberg.org/cache/epub/31552/pg31552.cover.medium.jpg,1,127|128,12,300,99,491,51,198
Candide,"""Candide"" by Voltaire is a satirical novel written in the mid-18th century. This work follows the misadventures of its main character, Candide, who is born into a privileged life but is soon expelled from his idyllic home and thrust into a world filled with absurdity, violence, and philosophical challenges. The story critiques the optimistic philosophy of the time, particularly through Candide's interactions with various characters and the dire circumstances he encounters.  The opening of ""Candide"" sets the stage with a glimpse into the life of the titular character, who grows up in the castle of Baron Thunder-ten-Tronckh, where he is taught by the optimistic philosopher Pangloss. Candide experiences a moment of youthful passion with Cunegonde, the Baron's daughter, but when discovered, he is brutally expelled from the castle. His naive belief that he lives in ""the best of all possible worlds"" is quickly challenged as he is thrust into a harsh reality marked by war and suffering. The beginning establishes the central themes of philosophy, love, and the inherent absurdity of life that will continue to develop throughout the novel. (This is an automatically generated summary.)",1949-06-08,https://www.gutenberg.org/cache/epub/19942/pg19942.cover.medium.jpg,1,129|5|131,32,454,483,355,187,42
Le Morte d'Arthur: Volume 1,"""Le Morte d'Arthur: Volume 1"" by Sir Thomas Malory is a historical account written in the late 15th century. The narrative explores the legendary romances of King Arthur and his noble Knights of the Round Table, detailing their adventures, battles, and code of chivalry. Central figures include King Arthur, Merlin the wizard, and Uther Pendragon, as the book delves into themes of honor, loyalty, and the consequences of desires.  The opening of the book introduces the backstory of Uther Pendragon, who falls in love with Igraine, the wife of the Duke of Cornwall. After a series of events fueled by desire and deception, King Arthur is conceived through a manipulation orchestrated by Merlin. The narrative unfolds with Uther's death and the subsequent turmoil as various nobles vie for power, ultimately leading to Arthur's miraculous acquisition of Excalibur and his acceptance as King. Through a series of battles and tournaments, the groundwork is laid for King Arthur's future as a just and noble ruler, facing opposition as he strives to unite the realm. (This is an automatically generated summary.)",1949-06-08,https://www.gutenberg.org/cache/epub/1251/pg1251.cover.medium.jpg,1,132|133|134,23,14,142,6,440,256
Oliver Twist,"""Oliver Twist"" by Charles Dickens is a novel written during the early 19th century, a time when social reform became an urgent issue in England. The story follows the misadventures of Oliver, a young orphan born in a workhouse, whose life is marred by poverty and cruelty as he navigates through a society that considers him a burden. From its opening chapters, the narrative sets the stage for Oliver's struggles against the oppressive workhouse system, which exploits children and neglects their basic needs.  The beginning of ""Oliver Twist"" introduces readers to the dire circumstances of Oliver's birth and early life, including the indifference of the workhouse authorities. After a difficult infancy spent in a cruel environment, Oliver is sent to a branch workhouse where he faces systematic mistreatment and deprivation. With no familial love or guidance, he learns quickly the harsh realities of life as a pauper. The opening chapters indicate how the workhouse environment shapes his personality and resilience while hinting at the significant encounters and challenges that await him as he seeks a better life. As we follow his journey, from infancy to a series of exploitative apprenticeships, we feel the urgency and vulnerability of his circumstances—a testament to Dickens' critique of social injustice. (This is an automatically generated summary.)",1949-06-08,https://www.gutenberg.org/cache/epub/730/pg730.cover.medium.jpg,1,1|135|5|137|5|139|5|141|5|15|5,23,78,134,276,432,68
Emma,"""Emma"" by Jane Austen is a novel written in the early 19th century, during the Regency era. The story centers around Emma Woodhouse, a lively and privileged young woman who relishes playing matchmaker among her friends, particularly after her beloved governess, Miss Taylor, marries Mr. Weston. This transition leaves Emma feeling a sense of solitude and motivates her to engage in her matchmaking schemes, which often involve her friend Harriet Smith, who is somewhat less socially positioned.  At the start of the narrative, readers are introduced to Emma's comfortable but somewhat sheltered life at Hartfield. The initial chapters outline Emma's reflections on her situation, her father Mr. Woodhouse's character, and her close bond with Miss Taylor, who has just married, leading to a poignant sense of loss for Emma. The opening portion establishes a contrast between Emma’s self-assured attitude and the potential consequences of her meddling, particularly as she begins to navigate her feelings towards Harriet and a potential match with young farmer Robert Martin. The dynamics of social class and the intricacies of relationships are evident, hinting at the complexities that will unfold as Emma's well-intentioned interventions may not yield the outcomes she anticipates. (This is an automatically generated summary.)",1949-06-08,https://www.gutenberg.org/cache/epub/158/pg158.cover.medium.jpg,1,1|105|5|147|5|149|5|151|152|153|5|101|5,21,302,130,474,421,121
Anna Karenina,"""Anna Karenina"" by Leo Tolstoy is a novel written in the late 19th century. The book explores the complex themes of love, family, and infidelity through its central character, Anna, alongside various other pivotal figures, including Stepan Arkadyevitch Oblonsky and his wife, Darya Alexandrovna. The story particularly delves into the social and moral dilemmas surrounding family life in Russian society.  The opening of the novel introduces the turbulent situation in the Oblonsky household, where Stepan Arkadyevitch (Stiva) has caused a scandal by having an affair with the family governess. The household is in chaos as Darya Alexandrovna has declared she cannot continue living with her husband after discovering his infidelity. Stepan's internal conflict is revealed as he wakes up in his study and reflects on his failing marriage and the grim reality of his actions. As the narrative unfolds, it illustrates the emotional turmoil affecting both Stepan and Darya as they navigate their strained relationship amidst societal expectations and personal desires. This opening segment effectively sets the tone for the intricate exploration of love and betrayal that characterizes the rest of the novel. (This is an automatically generated summary.)",1949-06-08,https://www.gutenberg.org/cache/epub/1399/pg1399.cover.medium.jpg,1,157|5|159|152|160|5|162|5,10,474,113,41,294,462
Carmilla,"""Carmilla"" by Joseph Sheridan Le Fanu is a gothic novella written in the late 19th century. The story revolves around Laura, a lonely young woman living in a secluded schloss in Styria, who encounters a mysterious and enchanting guest named Carmilla. As the narrative unfolds, the bond between Laura and Carmilla deepens, leading to an exploration of themes such as identity, desire, and the supernatural.  The opening of ""Carmilla"" introduces the reader to Laura and the desolate yet picturesque setting of her family's castle. Laura recounts a haunting childhood experience involving a mysterious lady who visited her in her nursery and evokes both fear and fascination. The narrative quickly transitions to her father's arrival, revealing the news of the tragic death of a young woman, which foreshadows the supernatural events to come. Soon after, a carriage accident leads to Carmilla's arrival as a guest, and Laura is immediately drawn to her, albeit with an undercurrent of foreboding. The stage is set for the powerful and strange relationship that will develop between them, characterized by dreams and an intertwining fate that will challenge Laura's understanding of herself and the world around her. (This is an automatically generated summary.)",1949-06-08,https://www.gutenberg.org/cache/epub/10007/pg10007.cover.medium.jpg,1,164|5|101|5,12,368,120,292,383,339
"The Kama Sutra of Vatsyayana: Translated From the Sanscrit in Seven Parts With Preface, Introduction and Concluding Remarks","""The Kama Sutra of Vatsyayana"" by Vatsyayana is a classical ancient Indian text that serves as a guide on love and sexuality, written in the early centuries of the Common Era. This work is often perceived as an erotic manual, but it encompasses a wider scope, addressing relationships, the social practices of the time, and the art of living well in accordance with sensual pleasures, virtue, and material wealth.   The opening portion of this treatise provides a preface to its significance in Sanskrit literature, highlighting its comprehensive nature alongside other works related to love and sexuality. It illustrates Vatsyayana's objective to condense existing knowledge into a structured format for the benefit of readers seeking to understand the complex interplay of desire, socio-cultural practices, and philosophy surrounding love. In this introduction, key themes such as the classification of women, sexual unions, and the importance of mutual respect and understanding between partners begin to surface, laying the groundwork for a deeper exploration into the art of love that follows in later chapters. (This is an automatically generated summary.)",1949-06-08,https://www.gutenberg.org/cache/epub/27827/pg27827.cover.medium.jpg,1,168|169,18,191,15,398,207,220
Don Quixote,"""Don Quixote"" by Miguel de Cervantes Saavedra is a classic novel written during the early 17th century. This groundbreaking work tells the story of an aging gentleman, Don Quixote, who becomes so enamored with tales of knight-errantry that he decides to embark on his own adventures as a self-proclaimed knight, accompanied by his pragmatic squire, Sancho Panza. The book serves as a satirical commentary on the romantic ideals of chivalry and the human experience, exploring themes of reality versus illusion.  The opening of ""Don Quixote"" introduces the protagonist, detailing his characteristics, motivations, and eccentric decision to assume the role of a knight after reading countless books on the subject. He becomes obsessed with the idea of reviving chivalry, despite the world around him having significantly changed. As he sets out on his journey armed with a makeshift suit of armor, he is both comedic and tragic—engaging in misadventures and encounters that illustrate the absurdity of his quest and the complexity of his character. The beginning sets the stage for a rich narrative filled with humor, philosophical depth, and memorable interactions between Don Quixote and Sancho Panza, ultimately inviting readers to ponder the nature of dreams and reality. (This is an automatically generated summary.)",1949-06-08,https://www.gutenberg.org/cache/epub/996/pg996.cover.medium.jpg,1,170|171|5|173|174|171|176|177|5,21,37,378,398,137,473
"Narrative of the Life of Frederick Douglass, an American Slave","""Narrative of the Life of Frederick Douglass, an American Slave"" by Douglass is a historical account written in the mid-19th century. The book chronicles the life of Frederick Douglass, detailing his experiences as a slave and eventually a prominent abolitionist. It offers not only a personal testimony of the brutalities and inhumanities of slavery but also Douglass's journey towards freedom and his quest for education.  The opening of the narrative provides an intimate perspective of Douglass's early life and the pain inflicted by the institution of slavery. He reflects on the uncertainty of his birth date, the cruel separation from his mother, and the horrific treatment he witnessed as a young slave. Douglass introduces readers to his first master, Captain Anthony, and describes the pervasive brutality of slavery through vivid recollections of witnessed violence and degradation. He emphasizes the emotional trauma caused by the slave system, including the stark reality of being regarded as property rather than a human being. This poignant introduction sets the stage for Douglass's courageous quest for literacy and freedom, compelling readers to engage with the profound injustices of his world. (This is an automatically generated summary.)",1949-06-08,https://www.gutenberg.org/cache/epub/23/pg23.cover.medium.jpg,1,179|180|181|182|181|184|185|180|181,30,155,139,443,310,241
Meditations,"""Meditations"" by Marcus Aurelius is a philosophical work written in the 2nd century AD. This collection of personal writings offers insights into the Stoic philosophy and reflects the inner thoughts and reflections of the Roman Emperor as he navigates the complexities of leadership and personal virtue. The primary focus of the text is on self-reflection, ethical principles, and the importance of maintaining a rational mind amidst life's challenges.  The opening of ""Meditations"" introduces the background of Marcus Aurelius, detailing his upbringing, education, and philosophical influences. It highlights his deep respect for family and mentors who shaped his character, instilling values such as gentleness, temperance, and duty. As the text unfolds, Marcus sketches his numerous debts of gratitude to those who influenced him, emphasizing a life of moderation and dedication to philosophy. He lays the groundwork for his meditations on the nature of the universe, the human condition, and the virtues of compassion and self-discipline, all of which frame his exploration of Stoicism throughout the work. (This is an automatically generated summary.)",1949-06-08,https://www.gutenberg.org/cache/epub/2680/pg2680.cover.medium.jpg,1,188|189|190,12,60,474,143,455,115
Winnie-the-Pooh,"""Winnie-the-Pooh"" by A. A. Milne is a children's novel written in the early 20th century. It brings to life the adventures of a beloved bear named Winnie-the-Pooh and his friends in the Hundred Acre Wood, including the charming Christopher Robin, the timid Piglet, and the gloomy Eeyore. The story is filled with whimsical themes of friendship, exploration, and the innocence of childhood.  At the start of the story, we are introduced to Winnie-the-Pooh as he comes down the stairs with a hearty bump and begins to think about honey, his favorite treat. The narrative includes playful dialogue with Christopher Robin, who encourages Pooh's thoughts and inquiries. Pooh initially plans to obtain honey from a swarm of bees and seeks Christopher Robin's help, leading to a hilariously imaginative attempt involving a balloon. The opening sets the tone for the enchanting and humorous adventures that follow, inviting readers into Pooh's delightful world filled with friends and charming escapades. (This is an automatically generated summary.)",1949-06-08,https://www.gutenberg.org/cache/epub/67098/pg67098.cover.medium.jpg,1,191|38|193|38|195|38|197|38|199|38|201|38|203|38,26,221,414,179,281,309
