title,description,release,cover,author_ids,category_ids,price,oneStarCount,twoStarCount,threeStarCount,fourStarCount,fiveStarCount
The call of the wild,"""The Call of the Wild"" by Jack London is a novel written in the late 19th century, during the time of the Klondike Gold Rush. The story revolves around Buck, a domesticated St. Bernard-Scotch Shepherd mix, who is thrust into the brutal and primal world of the Yukon wilderness, forced to shed his civilized upbringing and adapt to a harsh life of survival.  The opening of the book introduces Buck, who lives a comfortable life as a pet in Judge Miller's home in the Santa Clara Valley. However, his idyllic existence comes to an end when he is kidnapped by Manuel, a gardener's helper with gambling debts. Buck is soon transported to the north, where he faces mistreatment and a stark new reality. The narrative sets the stage for Buck's transformation from a pampered pet to a fierce survivor, illustrating the conflict between civilization and the primal instincts that begin to awaken within him as he navigates life in a wild, unforgiving landscape. (This is an automatically generated summary.)",1949-06-08,https://www.gutenberg.org/cache/epub/215/pg215.cover.medium.jpg,1,116|117|31|119|31|121|31|123|31|125|126|31|128|31,31,59,274,388,164,95
The Prince and the Pauper,"""The Prince and the Pauper"" by Mark Twain is a historical novel written in the late 19th century. The story revolves around two boys, Tom Canty, a poor pauper, and Edward Tudor, the Prince of Wales, whose lives become intertwined due to their striking resemblance and a series of events that lead to them switching places. In this narrative, Twain explores themes of class, identity, and the nature of royalty versus poverty, all while providing a critique of social injustices of his time.  At the start of the novel, we are introduced to both main characters on the same day in London during the 16th century. Tom Canty is born into a impoverished family that does not want him, while Edward Tudor is born to a wealthy family, celebrated by the entire nation. The narrative quickly depicts Tom's harsh living conditions in Offal Court, where he struggles against his family's abusive nature, despite his dreams of a better life. Contrastingly, Edward is surrounded by luxury, yet remains oblivious to the joy that such privilege brings. As the story unfolds, the boys' deep yearning to experience each other’s worlds leads to a serendipitous meeting that sets the stage for their fateful swap, reshaping their lives forever in unexpected ways. (This is an automatically generated summary.)",1949-06-08,https://www.gutenberg.org/cache/epub/1837/pg1837.cover.medium.jpg,1,130|31|132|31|134|135|31|137|31|139|31|141|31|143|31|145|31,12,264,22,429,65,450
The Elements of Style,"""The Elements of Style"" by William Strunk Jr. is a guidebook on English language usage, written in the early 20th century. The book outlines the essential principles of clear and concise writing, focusing on rules of usage and principles of composition that are frequently overlooked or violated. Its aim is to equip writers, both students and instructors, with practical tools for improving their writing style.  In ""The Elements of Style,"" Strunk emphasizes the importance of simplicity and clarity in writing, encouraging the use of active voice and specific language. Through a series of rules, he covers topics ranging from punctuation to sentence structure, advising readers to avoid lengthy or ambiguous expressions. The book also addresses common grammatical errors and misused expressions, providing practical examples to illustrate correct usage. Overall, it serves as a concise reference for anyone looking to enhance their writing skills and communicate more effectively. (This is an automatically generated summary.)",1949-06-08,https://www.gutenberg.org/cache/epub/37134/pg37134.cover.medium.jpg,1,21|148|21|150|151,10,236,102,137,405,293
The Philippines a Century Hence,"""The Philippines a Century Hence"" by José Rizal is a political and social commentary written in the late 19th century. This thought-provoking piece was originally published in a serial form in the Filipino fortnightly review ""La Solidaridad"" and subsequently compiled for readers in the early 20th century. The work discusses the potential future of the Philippines in relation to colonialism, governance, and national identity, positioned against the backdrop of Spanish rule and the growing influence of other powers, particularly the United States.  In this book, Rizal explores various potential scenarios for the Philippines over the next century, contemplating whether it would remain a Spanish colony, achieve independence, or fall under the rule of other foreign powers. He critiques the status quo, arguing that the Filipino people must be educated and recognized as equal in order to navigate their destiny. The essay emphasizes the need for reform and the incorporation of Filipino representatives in governance, warning that continued oppression could lead to violent revolts. Ultimately, Rizal advocates for a more enlightened and liberal policy from Spain to foster goodwill, insisting that the future of the Philippines depends on the empowerment and self-determination of its people. Through rich historical analysis and forward-thinking insights, Rizal articulates a vision for national progress and unity, establishing himself as a herald of Filipino nationalism. (This is an automatically generated summary.)",1949-06-08,https://www.gutenberg.org/cache/epub/35899/pg35899.cover.medium.jpg,1,1,12,300,479,458,220,410
Siddhartha,"""Siddhartha"" by Hermann Hesse is a philosophical novel written during the early 20th century. The story revolves around a young Indian Brahman named Siddhartha, who embarks on a spiritual journey in search of enlightenment and self-discovery amidst the complexities of life, including friendship, love, and the quest for true meaning beyond mere existence.  The opening portion of the book introduces Siddhartha as a gifted and intelligent son of a Brahman who is deeply loved by his family and friends, particularly his companion Govinda. Despite his privileged upbringing and the affection showered upon him, Siddhartha feels a profound emptiness within and begins to question traditional teachings and the spiritual practices prescribed by his father and the Brahmins. Discontented with a life focused solely on rituals and worship, he declares his intention to leave home and journey into asceticism with the Samanas, a group of wandering monks, suggesting the start of his quest for deeper truths about existence and the nature of the self. (This is an automatically generated summary.)",1949-06-08,https://www.gutenberg.org/cache/epub/2500/pg2500.cover.medium.jpg,1,153|31|155|31|157|31|159|31|161|162|31|161|105|31|167|31|169|31,20,166,225,103,251,255
Complete Original Short Stories of Guy De Maupassant,"""Complete Original Short Stories of Guy de Maupassant"" by Guy de Maupassant is a comprehensive collection of short stories likely written in the late 19th century. The anthology features the author's sharp observations of human nature, social struggles, and moral dilemmas, often illuminating the tensions between various classes and the impact of war on civilian life.  At the start of the collection, there is an introduction to Maupassant's life and his literary beginnings, highlighting his rapid rise to fame and the influences that shaped his writing style. The opening story, ""Boule de Suif,"" sets the stage for a tense scenario during the Franco-Prussian War, focusing on a group of travelers caught in a snowstorm and their moral quandaries regarding the titular character, a voluptuous prostitute. The narrative delves into the dynamics of class, respectability, and sacrifice, showcasing Maupassant's ability to blend social criticism with compelling storytelling. (This is an automatically generated summary.)",1949-06-08,https://www.gutenberg.org/cache/epub/3090/pg3090.cover.medium.jpg,1,171|172|173|172,32,497,404,29,13,336
The Jungle,"""The Jungle"" by Upton Sinclair is a novel written during the early 20th century. The book delves into the harsh realities of immigrant life in America, specifically focusing on the struggles of the working class in the meatpacking industry of Chicago. Central to the narrative are the characters Jurgis Rudkus and his young bride Ona Lukoszaite, whose romantic beginnings foreshadow the challenges and tragic circumstances they will face in a rapidly industrializing society.  The opening of ""The Jungle"" introduces us to the wedding celebration of Jurgis and Ona, filled with cultural customs and a lively atmosphere, yet shadowed by the grimy backdrop of the Chicago stockyards. The festivities are led by the energetic Cousin Marija, who embodies the joy and chaos of the occasion. Amidst the merriment, the narrative hints at the burdens of social and financial pressures that will soon engulf the couple. As guests mingle and the music plays, the toll of their working-class life begins to set in, establishing a stark contrast between the fleeting moments of joy and the relentless struggles they are bound to encounter in their new world. (This is an automatically generated summary.)",1949-06-08,https://www.gutenberg.org/cache/epub/140/pg140.cover.medium.jpg,1,175|31|177|31|179|31|181|31|183|184|31|186|31,10,84,468,364,353,230
David Copperfield,"""David Copperfield"" by Charles Dickens is a novel written in the mid-19th century. The story revolves around the life of David Copperfield, detailing his personal growth and the myriad experiences that shape his character from childhood through adulthood.   At the start of the narrative, we are introduced to David's birth and the circumstances surrounding it, including the death of his father before he was born and the presence of his stern aunt, Miss Betsey Trotwood. David’s early life is characterized by maternal affection and childhood curiosity, as we meet key figures such as his mother, Peggotty, and the mysterious Miss Betsey, who is eager to have a strong influence in his life. The opening chapters not only set the stage for David's unfolding journey but also hint at the complexities of familial relationships and the challenges he will face as he navigates the trials of growing up without a father. (This is an automatically generated summary.)",1949-06-08,https://www.gutenberg.org/cache/epub/766/pg766.cover.medium.jpg,1,188|189|130|31|192|31|30|31|15|31|198|31|200|31,33,425,272,153,434,150
"The Mahabharata of Krishna-Dwaipayana Vyasa, Volume 1: Books 1, 2 and 3","""The Mahabharata of Krishna-Dwaipayana Vyasa, Volume 1"" by Kisari Mohan Ganguli is a monumental epic narrative written in the late 19th century. This work is a translation of the ancient Indian masterpiece, the Mahabharata, originally in Sanskrit, which is revered for its profound exploration of dharma (duty/righteousness), morality, and the complex dynamics of human relationships. The book embodies a diverse tapestry of characters and mythical narratives, centering around the rivalries of the Kauravas and Pandavas.  The opening of the text introduces the illustrious sages gathered at a grand sacrifice in the forest of Naimisha, where they express their desire to hear the sacred recounting of the Mahabharata. The narrator, Sauti, shares his journey of acquiring and retelling the stories of Vyasa, which encompass themes of nobility, struggle, and divine intervention. The characters introduced set the stage for the epic's exploration of life's intricate choices, as well as the consequences of actions in the grand narrative of the battle between righteousness and chaos that unfolds throughout the Mahabharata. This opening portion establishes the rich context and philosophical backdrop that will guide readers through the complexities of the epic tale. (This is an automatically generated summary.)",1949-06-08,https://www.gutenberg.org/cache/epub/15474/pg15474.cover.medium.jpg,1,1,21,200,67,219,92,191
On War,"""On War"" by Carl von Clausewitz is a philosophical treatise on military strategy and the nature of warfare written in the early 19th century. The work addresses the concept of war as a means to achieve political objectives, outlining its inherent complexities and the balance between military actions and political aims.  The opening of ""On War"" presents an introduction that contextualizes the significance of warfare in relation to political objectives, particularly within the European landscape of the time. Clausewitz emphasizes that war is an act of violence aimed at compelling the adversary to fulfill one's will and examines the psychological and social underpinnings that lead nations into war. He discusses the necessity of understanding not just the immediate military goals, but also the broader political context, setting the stage for a comprehensive analysis of warfare that blends strategy, morality, and the dynamics of power. (This is an automatically generated summary.)",1949-06-08,https://www.gutenberg.org/cache/epub/1946/pg1946.cover.medium.jpg,1,203|204,20,105,62,234,121,47
Symposium,"""Symposium"" by Plato is a philosophical dialogue written during the late 4th century BC. The work centers on a banquet at which prominent figures, including Socrates, Phaedrus, Aristophanes, and Alcibiades, take turns delivering speeches in praise of love, exploring the various dimensions and ideals of the concept. Through their discussions, the dialogue delves into themes such as the nature of love, the relationship between physical attraction and deeper emotional connections, and the role of love in achieving virtue and wisdom.  The opening of the ""Symposium"" introduces a character named Apollodorus, who recounts the events of the banquet, eager to share the speeches on love he learned from his friend Aristodemus. Apollodorus describes how Socrates, invited by Agathon to the celebration following his victory in the dramatic competitions, engages with various guests, each of whom presents their unique perspectives on love. Notably, the speeches explore the distinctions between different types of love—earthly vs. heavenly—and the implications of love on personal virtue and societal dynamics, setting the stage for a rich examination of this central human experience that runs throughout the dialogue. (This is an automatically generated summary.)",1949-06-08,https://www.gutenberg.org/cache/epub/1600/pg1600.cover.medium.jpg,1,205|206|207|208|209,16,178,10,7,134,353
Spoon River Anthology,,1949-06-08,https://www.gutenberg.org/cache/epub/26471/pg26471.cover.medium.jpg,1,1,31,407,44,398,339,5
Tess of the d'Urbervilles: A Pure Woman,"""Tess of the d'Urbervilles: A Pure Woman"" by Thomas Hardy is a novel written in the late 19th century during the Victorian era. The story revolves around Tess Durbeyfield, a young woman whose family lineage is revealed to be noble but now fallen into poverty. The novel explores themes of social class, gender roles, and the tragic consequences of self-discovery and societal expectations.  The opening of the novel introduces us to Tess's father, John Durbeyfield, who learns from a local parson that he is a descendant of the noble d'Urberville family. This revelation instills in him a sense of pride and prompts him to indulge in drunkenness, neglecting his responsibilities. Meanwhile, we see Tess as a naive and beautiful young woman participating in a May Day celebration, where she anxiously witnesses her father's display of pride. The incident with a horse, a vital source of livelihood for her family, leads to tragic consequences when it is killed in an accident due to her father's negligence, setting the stage for Tess's struggles as she takes on the role of caregiver and attempts to navigate her complicated family dynamics and emerging identity. (This is an automatically generated summary.)",1949-06-08,https://www.gutenberg.org/cache/epub/110/pg110.cover.medium.jpg,1,1|2|3|2|5|6|2|8|9|2|11|2|13|2|15|2|17|2|19|2,30,171,107,404,199,346
Don Juan,"""Don Juan"" by Lord Byron is a satirical epic poem written in the early 19th century. The poem follows the misadventures of its titular character, Don Juan, a young man who is not portrayed as a seducer, but rather as one who is easily seduced by women. Through various encounters and a humorous lens, Byron explores themes of love, societal norms, and human folly.  The opening of ""Don Juan"" sets a lively and witty tone, starting with an ironic dedication to poet Robert Southey, which critiques contemporary poets and celebrates poetic freedom. We are introduced to the protagonist, Don Juan, who is born in Seville to a noble father and a highly educated mother, Donna Inez, who has aspirations of making him a paragon of virtue. However, the narrative quickly hints at the complications of their relationships, particularly as Juan’s innocence leads him into the clutches of love and seduction, contrasting sharply with the societal expectations imposed upon him. The conflict escalates when Juan inadvertently becomes involved in a scandal with Donna Julia, leading to a comedic yet profound examination of moral hypocrisy and desire. (This is an automatically generated summary.)",1949-06-08,https://www.gutenberg.org/cache/epub/21700/pg21700.cover.medium.jpg,1,21|22,34,50,444,43,113,216
Childe Harold's Pilgrimage,"""Childe Harold's Pilgrimage"" by Lord Byron is a narrative poem written in the early 19th century, notable for its exploration of themes such as disillusionment, longing, and the beauty of nature. The poem follows the journey of Childe Harold, a young nobleman who, feeling weary and disenchanted with life in England, embarks on a quest for adventure and self-discovery through various countries, particularly in Southern Europe.   At the start of the poem, we are introduced to Harold, whose earlier life has been spent in hedonistic revelry, yet he now finds himself stricken with a profound sense of ennui and dissatisfaction. Feeling out of place in his own homeland, he decides to escape to foreign shores, hinting at a deeper inner turmoil. The opening portion sets the tone for his travels while reflecting on beauty, love, and the impermanence of life. Through poignant imagery and philosophical musings, Byron captures the essence of a restless spirit seeking solace and purpose, inviting readers to reflect on their own existence amidst historical and personal landscapes. (This is an automatically generated summary.)",1949-06-08,https://www.gutenberg.org/cache/epub/5131/pg5131.cover.medium.jpg,1,23|24|25|22|27|22,18,382,123,334,260,439
Uncle Tom's Cabin,"""Uncle Tom's Cabin"" by Harriet Beecher Stowe is a novel written in the mid-19th century that explores the moral complexities surrounding slavery in America. The story introduces us to a variety of characters affected by the institution of slavery, focusing particularly on Uncle Tom, a devout and dignified enslaved man, alongside other figures like Eliza, who is desperate to save her child from being sold, reflecting the heart-wrenching realities of such a system.  The opening of the book sets the stage in Kentucky, where Mr. Shelby, in financial distress, contemplates selling Uncle Tom and the young boy Harry to settle debts while conversing with the trader Haley. Through their dialogue, Stowe highlights the inhumane circumstances under which slaves are viewed as property rather than human beings, and we witness the initial stirrings of turmoil that compel Eliza to flee with her son upon hearing of their impending sale. The emotional depth and ethical dilemmas presented in these early chapters lay the groundwork for a powerful narrative that challenges readers to confront the harsh truths of slavery. (This is an automatically generated summary.)",1949-06-08,https://www.gutenberg.org/cache/epub/203/pg203.cover.medium.jpg,1,29|2|5|31|2|33|2|35|2|37|2|39|40|2|42|2|44|2,15,360,213,126,431,55
The Sorrows of Young Werther,"""The Sorrows of Young Werther"" by Johann Wolfgang von Goethe is a novel written during the late 18th century, specifically in the Sturm und Drang literary movement era. The story revolves around Werther, a young artist who becomes deeply infatuated with a woman named Charlotte, who is already betrothed to another man, leading him into a spiral of emotional distress and romantic turmoil.  The opening of the novel introduces us to Werther through a series of letters he writes to his friend Wilhelm. In these letters, he expresses his complex emotions about love, life, and nature. He describes the beauty of his surroundings and his internal struggle regarding his feelings for Charlotte. As he reflects on his past romantic entanglements and the nature of happiness, his passionate and introspective character begins to unfold. The beginning sets the stage for Werther's eventual emotional conflicts and highlights the themes of unrequited love and the intensity of youthful feelings that will define the trajectory of his fate throughout the novel. (This is an automatically generated summary.)",1949-06-08,https://www.gutenberg.org/cache/epub/2527/pg2527.cover.medium.jpg,1,46|47|2|49|2|51|46|2,22,495,491,318,3,409
Northanger Abbey,"""Northanger Abbey"" by Jane Austen is a novel written in the early 19th century. The story introduces Catherine Morland, a young woman whose unremarkable upbringing and lack of traditional beauty set her apart from the stereotypical hero-lines of romantic fiction. However, Catherine harbors a longing for adventure and the romantic ideals perpetuated by the novels she devours, which foreshadows her journey into society, particularly as she embarks on a trip to Bath.  The opening of the novel sets the stage for Catherine's character development and introduces her mundane life contrasted with her fantastical aspirations. From early childhood, it is clear that Catherine is more inclined towards physical activities than traditional feminine pastimes, a trait that persists into her teenage years as she develops a fascination for the very novels that shape her romantic notions. Her first significant adventure begins when she is invited to Bath, where she hopes to find excitement, friendship, and possibly romance, particularly with Mr. Tilney, a character that stirs her interest. The narrative promises a witty exploration of societal norms, personal growth, and the dissonance between one's reality and their expectations, making it an engaging read for those interested in character-driven stories that satirize romantic tropes. (This is an automatically generated summary.)",1949-06-08,https://www.gutenberg.org/cache/epub/121/pg121.cover.medium.jpg,1,54|2|56|2|56|47|60|2|62|56|2|65|66|67|2|69|70|71|2|73|74|2,13,440,203,31,235,174
Three Men in a Boat (To Say Nothing of the Dog),"""Three Men in a Boat (To Say Nothing of the Dog)"" by Jerome K. Jerome is a humorous novel written in the late 19th century. The story follows three friends—George, Harris, and the narrator, along with their dog Montmorency—who embark on a comedic and chaotic boating trip on the Thames as a remedy for their various ailments and to seek some rest and relaxation from their busy lives.  At the start of the book, the trio discusses their health woes, convinced they all suffer from a myriad of conditions. They decide that a boating expedition would be the ideal way to rejuvenate themselves, and they begin planning their trip, which leads to amusing arguments and whimsical considerations about their journey. The opening chapters set the tone for a lighthearted exploration of friendship, adventure, and the misadventures that arise from their well-intentioned plans, capturing the comedic essence of their personalities and the challenges they face even before they set sail. (This is an automatically generated summary.)",1949-06-08,https://www.gutenberg.org/cache/epub/308/pg308.cover.medium.jpg,1,76|56|78|2|80|2|82|83|2|85|2|51|88|56|78|2,30,99,152,116,437,259
An Enquiry Concerning Human Understanding,"""An Enquiry Concerning Human Understanding"" by David Hume is a philosophical treatise written during the early 18th century. The work explores the nature of human cognition, the limitations of human reason, and the principles underlying human understanding. Hume delves into important topics such as the origin of ideas, the relationship between causes and effects, the nature of belief, and the principles of association within our thoughts.  The opening of Hume's inquiry begins by distinguishing between two different types of philosophy, namely moral philosophy and a more analytical approach to understanding human nature. He outlines the merits of both, acknowledging that while the former aims to guide virtuous behavior through sentiment and understanding, the latter seeks to dissect and analyze the underlying principles that govern human cognition. Hume emphasizes that this analytical philosophy, while potentially more abstract and difficult to grasp, is essential for understanding the foundation of our beliefs and actions. He introduces the tension between practical and abstract reasoning, setting the stage for a deeper exploration of how humans perceive and process their experiences. (This is an automatically generated summary.)",1949-06-08,https://www.gutenberg.org/cache/epub/9662/pg9662.cover.medium.jpg,1,92|93,10,393,61,445,363,362
