title,description,release,cover,author_ids,category_ids,price,oneStarCount,twoStarCount,threeStarCount,fourStarCount,fiveStarCount
La Odisea,"""La Odisea"" by Homer is an epic poem likely composed in the 8th century BC. This seminal work of Western literature recounts the arduous journey of the hero Odysseus as he strives to return home to Ithaca after the Trojan War. Along his way, he encounters various mythical beings, treacherous waters, and numerous challenges that test his resolve and cunning. The narrative also intricately weaves in themes of loyalty, perseverance, and the power of the gods, particularly emphasizing the bond between Odysseus and his wife, Penelope.  The beginning of ""The Odyssey"" sets the stage for Odysseus's long and tumultuous return to his homeland, introducing readers to his plight as he is trapped on the island of Ogygia by Calypso, a nymph who desires him as her husband. Meanwhile, back in Ithaca, his son Telemachus is grappling with the suitors who have invaded their home, seeking to marry Penelope. The gods convene in Olympus, discussing Odysseus’s fate, with Athena advocating for his return. Telemachus, inspired by divine intervention, resolves to seek news of his father, setting off on his own journey that will intertwine with Odysseus's fate. (This is an automatically generated summary.)",1949-06-08,https://www.gutenberg.org/cache/epub/58221/pg58221.cover.medium.jpg,1,70|71|72,33,411,230,152,369,136
The Consolation of Philosophy,"""The Consolation of Philosophy"" by Boethius is a philosophical treatise written in the early 6th century. The work takes the form of a dialogue between Boethius and a personified figure of Philosophy, who arrives to comfort him during his imprisonment. The central theme explores the idea of true happiness and how it can be achieved, ultimately critiquing the fleeting nature of fortune and material success.  At the start of the text, Boethius presents himself in a state of despair, lamenting the misfortunes that have struck him after a period of great prosperity. As he writes verses expressing his sorrow, Philosophy appears to him, scolding the Muses for misguiding him and his despair. She engages him in a conversation that prompts Boethius to reflect on his true nature and the transient nature of wealth and status. Through their discourse, Philosophy aims to redirect his focus from external successes to the steadfast virtues of the mind, preparing him for a deeper understanding of happiness that transcends earthly miseries. This opening sets the stage for an exploration of adversity, virtue, and the meaning of true fulfillment. (This is an automatically generated summary.)",1949-06-08,https://www.gutenberg.org/cache/epub/14328/pg14328.cover.medium.jpg,1,73|74,27,479,489,287,161,431
Mansfield Park,"""Mansfield Park"" by Jane Austen is a novel written in the early 19th century. The story unfolds around the life and experiences of Fanny Price, a young girl who is sent to live with her wealthy relatives, the Bertrams, at Mansfield Park. The themes of class, morality, and the complexities of human relationships are woven throughout the narrative as Fanny navigates her new environment.  At the start of the story, we learn about Fanny Price's background and her transition from her own impoverished family to the Bertram household. Introduced to her new relatives, Fanny is shy and timid, struggling to fit in with her more affluent cousins who are critical of her background and education. The opening chapters set the stage for the exploration of Fanny's character and her relationships with the various members of the Bertram family, particularly Edmund Bertram, who shows her kindness and compassion amidst the indifference of others. As she grapples with her identity within this new class structure, the groundwork is laid for the intricate social dynamics and moral questions that will drive the plot forward. (This is an automatically generated summary.)",1949-06-08,https://www.gutenberg.org/cache/epub/141/pg141.cover.medium.jpg,1,75|31|77|31|79|31|81|31|83|12|31|86|87|31|16|31,24,384,140,154,454,52
The History of Herodotus — Volume 1,"""The History of Herodotus — Volume 1"" by Herodotus is a historical account written in the 5th century BC. This foundational text explores the events leading up to and including the Greco-Persian Wars, emphasizing the interactions and conflicts between various civilizations, particularly the Hellenes (Greeks) and the Barbarians (non-Greeks). Herodotus aims to preserve the deeds and decisions of notable individuals and to analyze the causes of these momentous wars.  The opening of the work sets the stage for an exploration of the origins of conflict, beginning with an account of how the quarrels between the Greeks and the Persians started. It recounts a series of mythological incidents involving the abduction of women, which the Persians claim initiated a cycle of vengeance. Central figures such as Croesus, the king of Lydia, are introduced in the context of their conquests and political machinations. The narrative suggests a complex interplay of personal actions and broader historical currents, emphasizing the notion that human prosperity is fleeting and often subject to downfall regardless of one’s status. This opening portion establishes both a historical and philosophical framework that invites readers to contemplate not just the events themselves, but the causes and consequences that shape history. (This is an automatically generated summary.)",1949-06-08,https://www.gutenberg.org/cache/epub/2707/pg2707.cover.medium.jpg,1,91|65|93|94,25,301,176,365,77,294
Hedda Gabler,"""Hedda Gabler"" by Henrik Ibsen is a play in four acts written during the late 19th century. This dramatic work revolves around the complex character of Hedda Tesman, newly married and struggling with her identity and ambitions in a stifling domestic life. The narrative explores themes of societal expectations, personal freedom, and the inner turmoil of its characters, particularly focusing on Hedda's conflict between her desires and the limitations imposed by her marriage and society.  The opening of ""Hedda Gabler"" introduces the setting—a spacious drawing room—where Miss Juliana Tesman and Berta, a servant, discuss the arrival of Hedda and her husband, George Tesman, after their wedding trip. As George enters with excitement about his scholarly pursuits, the dynamic of their relationship unfolds, revealing Hedda's discomfort and hints at her discontent with the domestic life that now defines her. The conversation touches on her refinement and social expectations, as well as her apparent detachment from her surroundings. The arrival of Thea Elvsted introduces another layer to the story, hinting at a past connection with Eilert Lovborg, who is suggested to be a central character in the unfolding drama. This initial scene sets the tone for the tensions and complications that will arise in Hedda's life as the narrative progresses, focusing on her struggle against the constraints of her environment and her own aspirations. (This is an automatically generated summary.)",1949-06-08,https://www.gutenberg.org/cache/epub/4093/pg4093.cover.medium.jpg,1,95|4|21|4|99|27|101|102|4,19,81,134,207,50,412
Reise in die Aequinoctial-Gegenden des neuen Continents. Band 2.,"""Reise in die Aequinoctial-Gegenden des neuen Continents. Band 2."" by Alexander von Humboldt is a scientific publication written in the mid-19th century. This work is part of Humboldt's extensive travels and observations in South America, focusing particularly on the diversity of its cultures, languages, and natural phenomena. The book delves into the indigenous peoples of the region, examining their languages, customs, and the impacts of colonization on their societies.  The opening of this volume introduces the Chaymas, an indigenous group living in the mountainous areas of present-day Venezuela. Humboldt reflects on the physical characteristics of the Chaymas, their social structures, agricultural practices, and the effects of missionary activity on their culture and language. He contrasts their way of life with other indigenous groups and provides a detailed description of their customs, clothing, and societal norms, setting the stage for a deeper exploration of their linguistic and cultural identity throughout the remainder of the volume. (This is an automatically generated summary.)",1949-06-08,https://www.gutenberg.org/cache/epub/24746/pg24746.cover.medium.jpg,1,104|105|106|105|105|109|105|65,16,468,472,207,102,156
"The Thousand and One Nights, Vol. I.: Commonly Called the Arabian Nights' Entertainments","""The Thousand and One Nights, Vol. I."" by Edward William Lane is a collection of Middle Eastern folktales written in the 19th century. This literary classic, often referred to as the ""Arabian Nights,"" encompasses a variety of enchanting stories, framed within the narrative of Shahrazád, who tells tales to captivate the king Shahriyár. The volume serves as a rich exploration of themes such as love, betrayal, and cunning, all set against a backdrop of opulent Arabian culture.  At the start of the collection, readers learn about King Shahriyár and his brother Shah-Zemán, who have ruled their kingdoms justly and joyfully for twenty years. Their lives take a dark turn when both uncover infidelities by their wives, leading to devastating actions. This sets the stage for Shahrazád, the vizier's daughter, who volunteers to marry the king, plotting to use her storytelling to stave off her inevitable execution. The opening intricately weaves together personal tragedy, the consequences of betrayal, and the power of stories, setting the tone for an epic journey through the captivating narratives that unfold in this beloved anthology. (This is an automatically generated summary.)",1949-06-08,https://www.gutenberg.org/cache/epub/34206/pg34206.cover.medium.jpg,1,112|113|114,11,207,36,460,215,369
Phaedrus,"""Phaedrus"" by Plato is a philosophical dialogue probably written in the late 4th century BC. The text primarily explores themes of love and rhetoric through a conversation between Socrates and Phaedrus, examining how these two concepts interrelate and what they signify about human nature and communication.  The opening of ""Phaedrus"" introduces Phaedrus, who recounts spending time with Lysias, a famous rhetorician. He prepares to share Lysias's newly composed speech on love, which argues that the non-lover might be preferable to the lover. As they walk to a nearby plane tree to read the speech, Socrates expresses skepticism about the value of the rhetoric, provoking a discussion on the nature of love, the art of speaking, and the distinction between knowledge and mere opinion. This sets the stage for a deeper exploration of the philosophy underlying emotional connections and how they can be articulated. (This is an automatically generated summary.)",1949-06-08,https://www.gutenberg.org/cache/epub/1636/pg1636.cover.medium.jpg,1,115|116|63|118|119|63|121|122|123|63,35,416,415,176,307,214
Cookery and Dining in Imperial Rome,"""Cookery and Dining in Imperial Rome"" by Apicius is a historical account and translation of an ancient Roman cookery text, likely from the early centuries of the Common Era. The book offers insights into the culinary practices, preferences, and social dining customs of the era, showcasing recipes and techniques that illustrate what Roman citizens ate and how they prepared their meals. This work serves as a valuable resource for historians, culinarians, and anyone interested in understanding ancient Roman culture through the lens of gastronomy.  The opening of ""Cookery and Dining in Imperial Rome"" outlines the significance of the Apicius text as a key source for understanding ancient culinary practices. It discusses the context in which the recipes were compiled and the challenges in accurately translating and interpreting the original material. The initial chapters emphasize the connection between the culinary traditions of ancient Rome and modern practices, highlighting how the content of Apicius still resonates in contemporary cooking. Along with a critique of previous historical interpretations, the beginning sets the stage for a detailed exploration of the book's recipes, their ingredients, and the lifestyle of those who enjoyed feasts in the heart of the Roman Empire. (This is an automatically generated summary.)",1949-06-08,https://www.gutenberg.org/cache/epub/29728/pg29728.cover.medium.jpg,1,125|126|63,24,498,281,210,413,310
Notre-Dame de Paris - Tome 1,"""Notre-Dame de Paris - Tome 1"" by Victor Hugo is a historical novel written in the early 19th century. Set in the backdrop of medieval Paris, it explores themes of love, fate, and the societal struggles of the time, primarily through the lives of its complex characters, including the hunchbacked bell-ringer Quasimodo and the beautiful Romani woman Esmeralda.   The opening of the novel begins with a preface that reflects on the author's encounter with an inscription carved into the ancient walls of Notre-Dame, which sets a tone of loss and nostalgia. He laments the dilapidation of historical architecture and expresses a deep appreciation for the artistry of the Gothic period. As the narrative unfolds, it transports readers to January 6, 1482, in Paris, where the townspeople gather for a festive celebration known as the Feast of Fools. The atmosphere is lively as the crowds flock to the Palais de Justice for a theatrical representation, hinting at the chaotic events that will intertwine the lives of the characters, resulting in both comic and tragic consequences. (This is an automatically generated summary.)",1949-06-08,https://www.gutenberg.org/cache/epub/70891/pg70891.cover.medium.jpg,1,128|31|130|65|132|31|134|135|31|137|65|139|31|141|31|143,27,140,135,419,429,185
灵历集光,"""灵历集光"" by Shangjie Song is a collection of personal diaries and reflections written in the 20th century. This work chronicles the life and spiritual journey of the author, offering insights into his experiences as a devoted servant of God during a period of revivals in China. The central character, Song Shangjie, appears to reflect on his deep personal faith, struggles with health, and his unwavering commitment to his ministry and the spread of the gospel.  At the start of the text, the introduction sets the stage by highlighting two significant figures in the history of the church revival in China, one of whom is the author himself. The opening portion details the spiritual and personal hardships faced by Song, including a severe heart condition and persistent ailments, juxtaposed against his commitment to preaching and healing in his evangelistic efforts. It also touches on his relationships with other church leaders, his family's sacrifice, and his dedication to spiritual work, all framed within his diary entries, which are noted to be heartfelt and deeply personal. The beginning establishes a profound and emotionally resonant narrative that seeks to capture the essence of a life lived in service to faith and adherence to spiritual principles. (This is an automatically generated summary.)",1949-06-08,https://www.gutenberg.org/cache/epub/25716/pg25716.cover.medium.jpg,1,144|145|146|147|144|62|150|151,20,128,100,240,50,383
"Boy Scouts Handbook: The First Edition, 1911","""Boy Scouts Handbook"" by Boy Scouts of America is a guidebook on scouting practices written in the early 20th century. This manual serves as an official reference for the Boy Scouts, detailing principles, practices, and virtues aimed at promoting character, citizenship, and outdoor skills among boys.   The opening of the handbook introduces the origins and aims of the Boy Scout Movement, emphasizing its widespread influence and the importance of building character and good citizenship in young boys. It presents a message from Chief Scout Ernest Thompson Seton, who shares his personal longing for outdoor knowledge and experiences, which sparked the creation of the scouting program. The text sets the groundwork for the various scout virtues and skills that will be further elaborated upon throughout the handbook, inviting boys from all walks of life to join and develop into well-rounded individuals through the teachings of scouting. (This is an automatically generated summary.)",1949-06-08,https://www.gutenberg.org/cache/epub/29558/pg29558.cover.medium.jpg,1,152|153|154|155|154,15,41,475,294,330,133
The Idiot,"""The Idiot"" by Fyodor Dostoyevsky is a novel written during the late 19th century. The story revolves around Prince Lef Nicolaievitch Muishkin, a young man returning to Russia after spending several years in a Swiss sanatorium for epilepsy. Through the prince, Dostoyevsky explores themes of innocence, social dynamics, and the clash between idealism and the harsh realities of life.  At the start of the novel, the prince is introduced on a train coming into St. Petersburg, where he meets fellow passengers who engage in conversation about their circumstances and backgrounds. Notably, he encounters Rogojin, a passionate and wealthy man who seems to have a deep interest in a beautiful woman named Nastasia Philipovna. The narrative begins to hint at complex relationships, societal expectations, and Muishkin’s unique perspective on life shaped by his illness and previous isolation. The opening chapters set a stage rich with contrasts between characters and unveil the future pivotal role that love and tragedy will play in the lives of these individuals. (This is an automatically generated summary.)",1949-06-08,https://www.gutenberg.org/cache/epub/2638/pg2638.cover.medium.jpg,1,134|23|102|159|31,25,325,178,395,237,78
Democracy in America — Volume 2,"""Democracy in America — Volume 2"" by Alexis de Tocqueville is a profound sociopolitical analysis written in the early 19th century. The text delves into the influence of democracy on American society, examining how the principle of equality shapes mental frameworks and societal norms, diverging significantly from the aristocratic traditions of Europe. Tocqueville's objective is to analyze the interplay between democracy and intellectual life, exploring both the benefits and potential hazards that arise from a democratic social structure.  The opening of the second volume sets the stage for Tocqueville's exploration of how democracy affects the actions of intellect in the United States. He observes that Americans tend to rely heavily on their own reasoning rather than deferring to traditional philosophical schools, yielding a unique philosophical method rooted in personal inquiry. Tocqueville also notes that this focus on individual understanding often leads to a skepticism towards abstract concepts and a tendency to dismiss the supernatural. He highlights the complexities of belief in democratic societies, asserting that while dogmatic beliefs are necessary for societal cohesion, they are shaped by the prevailing democratic ethos. Through these initial ideas, Tocqueville begins a comprehensive investigation into the dynamics of democracy, thought, and societal habits affecting American culture. (This is an automatically generated summary.)",1949-06-08,https://www.gutenberg.org/cache/epub/816/pg816.cover.medium.jpg,1,161|153|153|164|153|102,10,49,8,298,43,231
El paraíso perdido,"""El paraíso perdido"" by John Milton is an epic poem written in the 17th century. The work explores the biblical story of the Fall of Man, focusing on the characters of Adam and Eve, their temptation by Satan, and their subsequent expulsion from the Garden of Eden. The themes of free will, redemption, and the nature of good and evil are central to its narrative.  The opening of the poem lays the groundwork for its grand themes and ambitious scope. It begins with an invocation of the Muse and an exploration of the reasons for mankind's fall from grace. Milton introduces key concepts of sin and redemption while hinting at the epic journey that lies ahead. The initial portion sets a serious and contemplative tone, suggesting that the poem will intertwine rich theological reflections with profound human experiences, creating an intense intellectual and emotional landscape. (This is an automatically generated summary.)",1949-06-08,https://www.gutenberg.org/cache/epub/67092/pg67092.cover.medium.jpg,1,167|167|169,24,271,63,71,363,177
Perpetual Peace: A Philosophical Essay,"""Perpetual Peace: A Philosophical Essay"" by Immanuel Kant is a philosophical treatise written in the late 18th century. The essay presents Kant's arguments for achieving lasting international peace, addressing the complexities and contradictions inherent in human relations and the state of nations. The primary focus is on the moral principles and political structures that could foster a stable environment free of war among states.  The opening of the work introduces the context of the essay and discusses the importance of Kant's ideas against the backdrop of the ongoing interest in peace movements during his time. It highlights the historical evolution of thoughts surrounding war and peace, as well as the various philosophical influences on Kant, including the desire for a federation of nations that prioritizes mutual cooperation and moral governance. Kant argues that achieving perpetual peace requires facing the harsh realities of political life while aspiring towards moral ideals, suggesting that true peace can only be realized through a collective legal framework among states and the establishment of republican governments. (This is an automatically generated summary.)",1949-06-08,https://www.gutenberg.org/cache/epub/50922/pg50922.cover.medium.jpg,1,1,12,307,459,378,354,188
西遊記,"""西遊記"" by Cheng'en Wu is a classic Chinese novel written during the 16th century. The story follows the adventures of Sun Wukong, also known as the Monkey King, as he seeks enlightenment, faces numerous challenges, and ultimately accompanies a monk on a pilgrimage to retrieve sacred texts. This work combines elements of fantasy, adventure, and philosophical exploration, making it a timeless piece in literature.  The opening of ""西遊記"" introduces the mythical origins of Sun Wukong, who is born from a mystical stone on Flower-Fruit Mountain. As he grows, he showcases remarkable abilities, learning to walk, speak, and engage in playful antics with other monkeys. Despite the idyllic life in the mountains, Wukong grapples with existential thoughts about mortality and desires to achieve immortality. His journey begins as he decides to leave the mountains in search of wisdom and the means to escape death, leading to his eventual encounter with the Buddha and other celestial beings. This portion sets the groundwork for Wukong's character development and highlights the blending of humor and profound themes. (This is an automatically generated summary.)",1949-06-08,https://www.gutenberg.org/cache/epub/23962/pg23962.cover.medium.jpg,1,171|172|49|144|175|144|177|31,33,199,12,77,25,353
Mrs. Dalloway,"""Mrs. Dalloway"" by Virginia Woolf is a novel written in the early 20th century. Set in post-World War I London, the story unfolds over a single day in June, exploring themes of identity, time, and mental health through the eyes of its protagonist, Clarissa Dalloway, as she prepares for an evening party. The narrative weaves together her memories, her relationships, and her existential reflections, creating a profound exploration of life and the passage of time.  The opening of ""Mrs. Dalloway"" introduces us to Clarissa Dalloway, who decides to buy flowers for a party she is hosting later that evening. As she walks through London, she reflects on her past, her relationships, and her experiences, particularly with Peter Walsh, a former lover. The narrative elegantly captures her emotions and thoughts mingling with the bustling life of the city around her. Meanwhile, we are also introduced to Septimus Warren Smith, a war veteran struggling with the aftermath of combat and grappling with his mental health, hinting at the interconnected fates of the characters. The juxtaposition of these two lives paints a rich tapestry of societal dynamics, personal struggles, and the search for meaning in a rapidly changing world. (This is an automatically generated summary.)",1949-06-08,https://www.gutenberg.org/cache/epub/71865/pg71865.cover.medium.jpg,1,83|30|31|181|31|183|31|42|185|31|187|31,20,162,432,50,221,494
