title,description,release,cover,author_ids,category_ids,price,oneStarCount,twoStarCount,threeStarCount,fourStarCount,fiveStarCount
Simple Sabotage Field Manual,"""Simple Sabotage Field Manual"" by United States. Office of Strategic Services is a historical publication written during the early 1940s, amid World War II. This manual acts as a guide for ordinary civilians to conduct simple acts of sabotage against enemy operations without the need for specialized training or equipment. Its main topic revolves around promoting small, accessible forms of resistance that could collectively disrupt the enemy's war effort.  The manual outlines various strategies and techniques for citizens to engage in sabotage that could be executed discreetly and with minimal risk. It provides specific suggestions for targeting transportation, communication, and industrial facilities to create delays and inefficiencies in enemy operations. The manual emphasizes the power of many individuals acting independently to contribute to a larger campaign of disruption, encouraging simple acts such as misplacing tools, delaying communication, or damaging equipment with household items. Overall, the ""Simple Sabotage Field Manual"" serves as a unique historical artifact that illustrates grassroots resistance efforts and the belief in the collective power of ordinary people during wartime. (This is an automatically generated summary.)",1949-06-08,https://www.gutenberg.org/cache/epub/26184/pg26184.cover.medium.jpg,1,1,19,108,415,254,320,438
"Frankenstein; Or, The Modern Prometheus","""Frankenstein; Or, The Modern Prometheus"" by Mary Wollstonecraft Shelley is a novel written in the early 19th century. The story explores themes of ambition, the quest for knowledge, and the consequences of man's hubris through the experiences of Victor Frankenstein and the monstrous creation of his own making.   The opening of the book introduces Robert Walton, an ambitious explorer on a quest to discover new lands and knowledge in the icy regions of the Arctic. In his letters to his sister Margaret, he expresses both enthusiasm and the fear of isolation in his grand venture. As Walton's expedition progresses, he encounters a mysterious, emaciated stranger who has faced great suffering—furthering the intrigue of his narrative. This stranger ultimately reveals his tale of creation, loss, and the profound consequences of seeking knowledge that lies beyond human bounds. The narrative is set up in a manner that suggests a deep examination of the emotions and ethical dilemmas faced by those who dare to defy the natural order. (This is an automatically generated summary.)",1949-06-08,https://www.gutenberg.org/cache/epub/84/pg84.cover.medium.jpg,1,2|3|4|3|6|7|8|3|10|11|3,27,88,232,120,313,90
"Moby Dick; Or, The Whale","""Moby Dick; Or, The Whale"" by Herman Melville is a novel written in the mid-19th century. The story follows Ishmael, a sailor on a whaling voyage, who seeks adventure and escape from his gloomy life on land. As he embarks on this journey, he becomes drawn into the complex world of whaling and is introduced to the ominous figure of Captain Ahab, whose obsession with a legendary white whale ultimately drives the narrative.  At the start of the novel, Ishmael introduces himself and shares his philosophy about the sea as a remedy for his melancholic disposition. He muses on the magnetic pull of the ocean, describing not only his own urge to set sail but also the collective longing of city dwellers for the water. Ishmael's journey takes him to New Bedford, where he experiences a series of humorous and strange encounters while seeking lodging before joining a whaling ship. As he navigates his way through the town, he is introduced to Queequeg, a tattooed harpooner with a mysterious past, setting the stage for a unique friendship that unfolds amidst the backdrop of whaling adventures. (This is an automatically generated summary.)",1949-06-08,https://www.gutenberg.org/cache/epub/2701/pg2701.cover.medium.jpg,1,13|14|3|16|3|18|19|20|3|22|3|24|3|26|3,18,337,293,455,366,481
Pride and Prejudice,"""Pride and Prejudice"" by Jane Austen is a classic novel written in the early 19th century. The story delves into themes of love, social class, and individual agency, largely revolving around the life of Elizabeth Bennet, one of five sisters from a modest but genteel family navigating the complex social landscape of Regency England.  The opening of the novel introduces the seemingly universal truth that a single man of wealth is a target for matchmaking mothers in the neighborhood. Mrs. Bennet is eager to marry off her daughters and is excited to hear about the arrival of Mr. Bingley, a wealthy young man who has taken up residence at Netherfield Park. Mr. Bennet's teasing yet indifferent nature contrasts sharply with Mrs. Bennet's anxious and businesslike demeanor as she plans to visit Mr. Bingley to create an opportunity for her daughters. Their witty exchanges set the tone for the story's exploration of family dynamics and social expectations, while also hinting at deeper character developments and the challenges Elizabeth will face regarding love and prejudice in her interactions with Mr. Darcy and the Bingley family. (This is an automatically generated summary.)",1949-06-08,https://www.gutenberg.org/cache/epub/1342/pg1342.cover.medium.jpg,1,28|3|30|31|3|33|34|3|36|3|38|3,33,199,112,195,200,253
Romeo and Juliet,"""Romeo and Juliet"" by William Shakespeare is a tragedy likely written during the late 16th century. The play centers on the intense love affair between two young lovers, Romeo Montague and Juliet Capulet, whose families are embroiled in a bitter feud. Their love, while passionate and profound, is met with adversities that ultimately lead to tragic consequences.  At the start of the play, a Prologue delivered by the Chorus sets the stage for the tale of forbidden love, revealing the familial conflict that surrounds Romeo and Juliet. The opening scenes depict a public brawl ignited by the feud between the Montagues and Capulets, showcasing the hostility that envelops their lives. As we are introduced to various characters such as Benvolio, Tybalt, and Mercutio, we learn of Romeo's unrequited love for Rosaline. However, this quickly changes when Romeo encounters Juliet at the Capulet ball, where they share a famous and romantic exchange, unwittingly falling in love with each other despite their families' bitter enmity. This initial encounter foreshadows the obstacles they will face as their love story unfolds amidst chaos and conflict. (This is an automatically generated summary.)",1949-06-08,https://www.gutenberg.org/cache/epub/1513/pg1513.cover.medium.jpg,1,40|41|42|41|44|41|46|47|41|49|41|51|41,28,24,215,471,194,440
Alice's Adventures in Wonderland,"""Alice's Adventures in Wonderland"" by Lewis Carroll is a classic children's novel written in the mid-19th century. The story follows a young girl named Alice who, feeling bored and sleepy while sitting by a riverbank, encounters a White Rabbit and follows it down a rabbit hole, plunging into a fantastical world filled with curious creatures and whimsical adventures.  The opening of the book introduces Alice as she daydreams about her surroundings before spotting the White Rabbit, who is both flustered and animated. Curious, Alice pursues the Rabbit and finds herself tumbling down a deep rabbit hole, leading to a curious hall filled with doors, all locked. After experiencing a series of bizarre changes in size from eating and drinking mysterious substances, she begins exploring this new world, initially frustrated by her newfound challenges as she navigates her size and the peculiar inhabitants she meets. The narrative sets the tone for Alice's whimsical and often nonsensical adventures that characterize the entire tale. (This is an automatically generated summary.)",1949-06-08,https://www.gutenberg.org/cache/epub/11/pg11.cover.medium.jpg,1,53|54|55|56|57|54,19,42,401,196,236,469
The Great Gatsby,"""The Great Gatsby"" by F. Scott Fitzgerald is a novel written in the early 20th century. The story is mainly narrated by Nick Carraway, who reflects on the life of his enigmatic neighbor, Jay Gatsby, and the extravagant world of wealth and excess he inhabits. The novel explores themes of the American Dream, love, and social class.  At the start of the novel, Nick Carraway reflects on advice from his father about withholding judgment of others, which sets the stage for the unfolding narrative. We learn about Nick's background, his move to West Egg, and his connection to wealthy acquaintances like Tom and Daisy Buchanan. Nick's first glimpse of Gatsby is during a moment of solitude when he sees Gatsby reaching out toward a distant green light, symbolizing his unattainable dreams. This opening portion lays the groundwork for the intricate relationships and social dynamics in the world of 1920s America, hinting at the luxurious yet hollow lives that many characters lead. (This is an automatically generated summary.)",1949-06-08,https://www.gutenberg.org/cache/epub/64317/pg64317.cover.medium.jpg,1,59|3|61|3|63|3|18|65|3,19,185,339,369,219,67
A Doll's House : a play,"""A Doll's House"" by Henrik Ibsen is a three-act play written during the late 19th century. The story revolves around Nora Helmer and her seemingly perfect marriage to Torvald Helmer, as well as themes of gender roles, deception, and the struggle for identity within the constraints of societal expectations.  At the start of the play, we meet Nora, who enters her home in high spirits, preparing for Christmas and eagerly discussing her acquisitions with her husband, Torvald. Their playful banter reveals Nora's childlike demeanor and Torvald's patronizing affection for her. As they converse, it becomes evident there are underlying tensions: Nora has kept a significant secret involving a loan she took out to save Torvald's life during an illness. The arrival of Nora's old friend, Mrs. Linde, introduces additional complexity to the narrative. Their conversation hints at Nora’s hidden struggles and foreshadows the impending conflict as Krogstad, who has connections to Nora’s loan, enters the picture, setting the stage for the unfolding drama. (This is an automatically generated summary.)",1949-06-08,https://www.gutenberg.org/cache/epub/2542/pg2542.cover.medium.jpg,1,67|41|69|41|71|72|73|41,22,92,422,408,130,252
The Importance of Being Earnest: A Trivial Comedy for Serious People,"""The Importance of Being Earnest: A Trivial Comedy for Serious People"" by Oscar Wilde is a play written in the late 19th century. This witty farce revolves around the theme of mistaken identities and the absurdities of Victorian society, focusing on the lives of two friends, John Worthing and Algernon Moncrieff, who both assume fictitious personas to escape their societal obligations.   The opening of the play establishes Algernon Moncrieff's opulent flat, where he converses with his manservant Lane about the complexity of life and marriage. John Worthing, or ""Ernest"" in town, visits Algernon, expressing his purpose of proposing to Gwendolen Fairfax, Algernon's cousin. Through clever dialogue, the two men discuss their escapades and the concept of ""Bunburying,"" a euphemism for creating a fictional identity to avoid responsibilities. This sets the stage for comedic misunderstandings and romantic entanglements that unfold as they both navigate their relationships with the women in their lives, Gwendolen and Cecily Cardew. (This is an automatically generated summary.)",1949-06-08,https://www.gutenberg.org/cache/epub/844/pg844.cover.medium.jpg,1,75|31|41|78|41|80|41,27,419,88,402,327,202
The Complete Works of William Shakespeare,"""The Complete Works of William Shakespeare"" by William Shakespeare is a collection of classic literary works written in the late 16th to early 17th centuries. This comprehensive anthology includes a wide range of genres, encompassing sonnets, comedies, histories, and tragedies, all showcasing Shakespeare's unparalleled mastery of language and character development. Important themes such as love, ambition, betrayal, and the complexities of human nature resonate throughout these timeless pieces.  At the start of this collection, the reader is immediately introduced to Shakespeare's ""Sonnets,"" which serve as an eloquent prelude to his themes of love and beauty. These opening verses explore the fleeting nature of beauty and time, with a poignant focus on the necessity of procreation to preserve youthful beauty. The sonnets address a young man of remarkable beauty and the poet's passionate urge for him to reproduce, emphasizing the tensions between self-love and the desire for legacy. Through rhythmic language and rich imagery, the sonnets present a universal contemplation on love, mortality, and the human experience, inviting readers to engage deeply with concepts that remain relevant today. (This is an automatically generated summary.)",1949-06-08,https://www.gutenberg.org/cache/epub/100/pg100.cover.medium.jpg,1,82|83,13,244,312,457,409,46
Middlemarch,"""Middlemarch"" by George Eliot is a novel written in the mid-19th century that explores the lives and interactions of residents in a provincial English town. The story primarily centers around Dorothea Brooke, a young woman with high ideals and aspirations for a meaningful life, who grapples with her search for love and purpose amid societal expectations. The novel addresses themes of marriage, ambition, and the intersection of personal and social values in a rapidly changing world.  At the start of the novel, we are introduced to Miss Brooke, who is depicted as a strikingly beautiful and intelligent young woman, yet may be seen as eccentric due to her lofty aspirations and disregard for societal norms. She lives with her sister Celia and their uncle, Mr. Brooke, in a quiet country house, harboring dreams of making a significant impact on the world. As the opening chapters unfold, we see her rejection of traditional feminine pursuits and her desire to be with a man of intellect who can match her aspirations. Important characters such as the learned Reverend Edward Casaubon and the kind Sir James Chettam emerge, each representing different paths and values that will challenge Dorothea in her quest for fulfillment. The complexities of their interactions are foreshadowed early on, setting the stage for a rich exploration of human relationships and personal growth. (This is an automatically generated summary.)",1949-06-08,https://www.gutenberg.org/cache/epub/145/pg145.cover.medium.jpg,1,84|85|3|87|30|31|3|33|90|3|38|3,33,35,38,194,348,455
"Little Women; Or, Meg, Jo, Beth, and Amy","""Little Women; Or, Meg, Jo, Beth, and Amy"" by Louisa May Alcott is a classic novel written in the mid-19th century. The story revolves around the lives and experiences of four sisters—Meg, Jo, Beth, and Amy March—as they navigate the challenges of growing up in a modest household during the American Civil War. The novel explores themes of family, sacrifice, and the pursuit of personal dreams, showcasing the distinct personalities and aspirations of each sister.  The opening of the book introduces readers to the March sisters, who are grappling with their financial struggles and longing for a more comfortable life. As they gather around the fire to express their frustrations about being poor, their mother reinforces the idea that they should embrace gratitude and make sacrifices for those suffering during the war, particularly their father, who is away serving as a chaplain. This chapter sets the tone for the sisters' individual journeys, highlighting their different approaches to hardship—Meg longs for material wealth, Jo is a spirited tomboy who craves independence, Beth is the gentle peacemaker, and Amy is the aspiring artist concerned with appearances. Through their interactions and hopes, Alcott paints a vivid picture of their lives, filled with warmth, humor, and the bonds of sisterhood. (This is an automatically generated summary.)",1949-06-08,https://www.gutenberg.org/cache/epub/37106/pg37106.cover.medium.jpg,1,94|84|30|95|96|3|98|3|100|3|96|3|34|3|38|3,29,9,34,103,469,357
A Room with a View,"""A Room with a View"" by E. M. Forster is a novel written during the early 20th century, which explores themes of social conventions and personal freedom. Set primarily in Italy and England, the narrative follows the journey of Lucy Honeychurch, a young woman navigating her feelings about love, societal expectations, and her own desires against the backdrop of her experiences abroad.  The opening of the story introduces the character of Lucy and her cousin Charlotte Bartlett as they arrive at the Pension Bertolini in Florence. Disappointed by the accommodation’s lack of a promised view, they bicker about their arrangements. Lucy's eagerness to experience Italy conflicts with Charlotte's more cautious demeanor. Here, the reader meets Mr. Emerson and his son George, who challenge the norms of polite society, offering their rooms to Lucy and Charlotte out of kindness, which Charlotte initially declines. The tension between personal desires and societal expectations is palpable, setting the stage for Lucy's internal conflict and her eventual blossoming into independence and self-discovery. (This is an automatically generated summary.)",1949-06-08,https://www.gutenberg.org/cache/epub/2641/pg2641.cover.medium.jpg,1,108|109|3|31|3|113|3|115|38|3,18,277,484,362,200,258
The Picture of Dorian Gray,"""The Picture of Dorian Gray"" by Oscar Wilde is a novel written during the late 19th century. The story explores themes of art, beauty, and morality, centering on the life of a young man named Dorian Gray, who becomes entranced by his own beauty and the hedonistic philosophies of Lord Henry Wotton. As Dorian gains fame and pleasure through his youthful looks, he grapples with the implications of vanity and the cost of immortality.  At the start of the novel, we are introduced to Lord Henry Wotton and the artist Basil Hallward, who has painted a stunning portrait of Dorian Gray. Basil is deeply enamored with Dorian's beauty and harbors a secret affection for him. The opening chapters establish the dynamic between Lord Henry's cynical worldview and Basil's idealism, culminating in Dorian's arrival in the studio. Dorian's first encounter with Lord Henry sparks a transformative moment; as they converse, Dorian is exposed to Henry’s hedonistic philosophies, which shape his perception of beauty and life. The chapter sets a tone that hints at the foreboding price Dorian may pay for his fascination with youth and aesthetic pleasure. (This is an automatically generated summary.)",1949-06-08,https://www.gutenberg.org/cache/epub/174/pg174.cover.medium.jpg,1,118|3|120|3|87|122|123|124|3|126|123|128|3|130|131|3|133|3,10,368,177,498,141,112
The Blue Castle: a novel,"""The Blue Castle"" by L. M. Montgomery is a novel written in the early 20th century. The story centers around Valancy Stirling, a nearly thirty-year-old woman who feels trapped in her life as an unmarried woman in a family that shows little regard for her. The opening of the novel introduces Valancy's bleak existence, characterized by a suffocating home life and a longing for romance and meaning that she has never experienced.  At the start of the book, Valancy awakens on a rainy morning weighed down by her impending birthday and the realization of her unfulfilled life. As she reflects on her circumstances, the reader gains insight into her despair and her dreams of an idealized life represented by her fantastical ""Blue Castle."" She feels oppressed by her family's expectations and by her status as a ""hopeless old maid."" Valancy's introspection reveals both her sense of humor and her deep-rooted sorrow, setting the stage for the profound changes that her impending fate may bring. The subsequent narrative promises to explore themes of self-discovery and rebellion against familial constraints as Valancy contemplates her situation. (This is an automatically generated summary.)",1949-06-08,https://www.gutenberg.org/cache/epub/67979/pg67979.cover.medium.jpg,1,135|123|137|3|139|3|141|3|143|144|3|146|3|148,19,133,47,129,204,375
The Strange Case of Dr. Jekyll and Mr. Hyde,"""The Strange Case of Dr. Jekyll and Mr. Hyde"" by Robert Louis Stevenson is a novella written during the late 19th century that delves into the duality of human nature and the struggle between good and evil. The narrative follows Mr. Utterson, a lawyer, as he investigates the mysterious relationship between his friend, Dr. Jekyll, and the sinister Mr. Hyde, uncovering dark secrets that test the boundaries of morality.  At the start of the novella, we meet Mr. Utterson and his distant cousin, Mr. Enfield, who discuss a strange door that Enfield associates with a disturbing story about Hyde trampling a young girl and displaying an unsettling demeanor. Utterson becomes increasingly intrigued by Hyde, especially when he discovers that Hyde stands to inherit Jekyll's wealth upon the doctor's disappearance. The text evokes a sense of foreboding as Utterson grapples with his concerns for Jekyll's welfare while unraveling the enigma surrounding Hyde, whose appearance elicits an inexplicable sense of dread. As the tale unfolds, it sets the stage for a profound exploration of identity, shame, and the darker aspects of human behavior. (This is an automatically generated summary.)",1949-06-08,https://www.gutenberg.org/cache/epub/43/pg43.cover.medium.jpg,1,7|126|3|151|3|153|3|18|10|155|3,21,466,251,292,388,383
The Enchanted April,"""The Enchanted April"" by Elizabeth Von Arnim is a novel written in the early 20th century. The story revolves around four women who seek a transformative escape from their mundane lives in cold, rainy England to the alluring sunshine of a mediaeval castle in Italy. The main characters introduced are Mrs. Wilkins and Mrs. Arbuthnot, both of whom are discontented with their respective circumstances and longing for a change.  At the start of the novel, Mrs. Wilkins, feeling trapped in her drab life, stumbles upon an advertisement for a rental castle in Italy while at a Women's Club in London. Drawn to the idea of warmth and beauty, she impulsively starts a conversation with the similarly yearning Mrs. Arbuthnot. As they discuss the advertisement, an unexpected bond forms, leading them to consider sharing the castle with two other women to make the plan financially feasible. This opening sets the stage for an uplifting journey where the characters’ quest for personal joy and freedom unfolds against the backdrop of picturesque Italy, suggesting themes of self-discovery and the rejuvenating power of adventure. (This is an automatically generated summary.)",1949-06-08,https://www.gutenberg.org/cache/epub/16389/pg16389.cover.medium.jpg,1,108|109|3|30|160|3|109|3|33,18,193,206,134,220,179
The Yellow Wallpaper,"""The Yellow Wallpaper"" by Charlotte Perkins Gilman is a short story written in the late 19th century, often associated with the feminist literature genre. The narrative explores the themes of mental illness, gender roles, and the constraints faced by women in a patriarchal society. It follows the mental deterioration of a woman who is confined to a room by her husband, who is also her physician, under the pretense of helping her recover from what he diagnoses as temporary nervous depression.  The story is presented as a series of journal entries written by an unnamed woman who is taken to a secluded mansion for rest cure. As she spends time in the nursery, she becomes increasingly obsessed with the room's yellow wallpaper, which she finds repulsive yet fascinating. Over time, she perceives a figure of a woman trapped within the wallpaper, reflecting her own feelings of oppression and entrapment. As the protagonist's isolation and desperation grow, she begins to identify with the figure, leading to a dramatic climax where she asserts her will by tearing down the wallpaper, ultimately rejecting the control her husband has over her life. The story is a powerful commentary on the struggles against patriarchal domination and the importance of self-identity and freedom. (This is an automatically generated summary.)",1949-06-08,https://www.gutenberg.org/cache/epub/1952/pg1952.cover.medium.jpg,1,164|63|166|3|168|3|18|170|3,18,449,380,208,170,186
